compny,title,link
Elastic,Elastic Cloud Python Developer python dev cloud digital nomad,https://remoteok.io//remote-jobs/73894-remote-cloud-python-developer-elastic
Circuit Stream,"Circuit Stream Sr Full Stack Developer, Django django aws python full stack dev digital nomad",https://remoteok.io//remote-jobs/73837-remote-sr-full-stack-developer-django-circuit-stream
Soshace,Soshace Remote Python Back-end Web Developer python django linux sql web development web dev backend dev digital nomad,https://remoteok.io//remote-jobs/73701-remote-remote-python-back-end-web-developer-soshace
SlashData,SlashData Full Stack Software Engineer (JS) frontend javascript react redux aws lambda python front end full stack dev engineer digital nomad serverless,https://remoteok.io//remote-jobs/73663-remote-full-stack-software-engineer-js-slashdata
Soshace,Soshace Senior Django Developer python dev senior digital nomad,https://remoteok.io//remote-jobs/73519-remote-senior-django-developer-soshace
Vocinity,Vocinity Senior Python Developer python dev senior digital nomad,https://remoteok.io//remote-jobs/73506-remote-senior-python-developer-vocinity
Surge,Surge Senior Python Javascript Engineer python javascript senior engineer,https://remoteok.io//remote-jobs/73331-remote-senior-python-javascript-engineer-surge
Caktus Consulting Group,Caktus Consulting Group Django Web Developer python dev web dev digital nomad,https://remoteok.io//remote-jobs/73333-remote-django-web-developer-caktus-consulting-group
Clevertech,Clevertech Python Developer python dev digital nomad,https://remoteok.io//remote-jobs/73304-remote-python-developer-clevertech
Doximity,"Doximity Software Engineer, Data python sql healthcare healthtech data pipelines git unix aws dev engineer digital nomad",https://remoteok.io//remote-jobs/73235-remote-software-engineer-data-doximity
Platform.sh,Platform.sh Python Cloud Developer python dev cloud digital nomad,https://remoteok.io//remote-jobs/73070-remote-python-cloud-developer-platform-sh
Interview Schedule,Interview Schedule Senior Full Stack Engineer dev python javascript flask react postgresql aws postgres full stack senior engineer digital nomad,https://remoteok.io//remote-jobs/73058-remote-senior-full-stack-engineer-interview-schedule
SmileDirectClub,SmileDirectClub Sr Python Software Engineer python dev engineer digital nomad,https://remoteok.io//remote-jobs/73036-remote-sr-python-software-engineer-smiledirectclub
Musement,Musement Python Developer python dev digital nomad,https://remoteok.io//remote-jobs/72846-remote-python-developer-musement
Close,Close Senior Software Engineer - Backend (100% Remote) python mongodb elasticsearch redis postgres dev senior engineer backend digital nomad mongodb,https://remoteok.io//remote-jobs/72794-remote-senior-software-engineer-backend-100-remote-close
Daupler,Daupler Python Django Developer python dev digital nomad,https://remoteok.io//remote-jobs/72664-remote-python-django-developer-daupler
causaLens,causaLens Senior Python Developer python big data machine learning numpy scipy django sklearn keras celery postgres aws gcp dev senior digital nomad,https://remoteok.io//remote-jobs/72638-remote-senior-python-developer-causalens
Skillcrush,Skillcrush Python SME sme curriculum writing e-learning python,https://remoteok.io//remote-jobs/72616-remote-python-sme-skillcrush
Pivotal Energy Solutions,Pivotal Energy Solutions Mid Level Django Backend Developer python dev backend digital nomad,https://remoteok.io//remote-jobs/72547-remote-mid-level-django-backend-developer-pivotal-energy-solutions
PolySwarm,PolySwarm Full-stack Developer blockchain ethereum python malware solidity javascript dev digital nomad fullstack full stack,https://remoteok.io//remote-jobs/72406-remote-full-stack-developer-polyswarm
Namaste Technologies,Namaste Technologies Senior Python Software Engineer python dev senior engineer digital nomad,https://remoteok.io//remote-jobs/72239-remote-senior-python-software-engineer-namaste-technologies
ReCharge Payments,ReCharge Payments Python Software Engineer python dev engineer digital nomad,https://remoteok.io//remote-jobs/71975-remote-python-software-engineer-recharge-payments
Doximity,Doximity Mobile Automation Engineer mobile python ruby swift ios app android app healthcare android ios engineer ruby ios,https://remoteok.io//remote-jobs/71867-remote-mobile-automation-engineer-doximity
"Zoomforth, Inc.","Zoomforth, Inc. Engineering Manager python react aws javascript exec engineer",https://remoteok.io//remote-jobs/71515-remote-engineering-manager-zoomforth-inc-
DjangoForce,DjangoForce Expert Django Developer python dev digital nomad,https://remoteok.io//remote-jobs/71500-remote-expert-django-developer-djangoforce
Doximity,"Doximity Software Engineer, Service Reliability chef terraform python mysql rubyonrails golang sql dev sys admin engineer digital nomad admin sql",https://remoteok.io//remote-jobs/71432-remote-software-engineer-service-reliability-doximity
Label Insight,Label Insight Java Engineer With Python Experience python java engineer,https://remoteok.io//remote-jobs/71392-remote-java-engineer-with-python-experience-label-insight
Doximity,"Doximity Software Engineer, Ruby & Javascript ruby javascript healtcare tech python spark mysql sql dev engineer digital nomad sql ruby",https://remoteok.io//remote-jobs/71367-remote-software-engineer-ruby-javascript-doximity
komoot,"komoot Backend Engineer (algorithms, Rankings and Recommendations) java python engineer backend",https://remoteok.io//remote-jobs/71319-remote-backend-engineer-algorithms-rankings-and-recommendations-komoot
Codelitt,Codelitt Senior Full Stack Developer with React Experience react ruby golang c# python javascript c c plus plus full stack dev senior digital nomad c c plus plus ruby,https://remoteok.io//remote-jobs/71132-remote-senior-full-stack-developer-with-react-experience-codelitt
Hubbub,Hubbub Lead Software Engineer django python postgresql aws saas postgres dev exec engineer digital nomad,https://remoteok.io//remote-jobs/71202-remote-lead-software-engineer-hubbub
Marqeta,Marqeta Sr. Infrastructure Security Engineer - Oakland or Remote infosec java javascript python go ruby engineer ruby,https://remoteok.io//remote-jobs/71026-remote-sr-infrastructure-security-engineer-oakland-or-remote-marqeta
Marqeta,Marqeta Application Security Engineer - Oakland or Remote infosec java javascript ruby go python engineer ruby,https://remoteok.io//remote-jobs/71024-remote-application-security-engineer-oakland-or-remote-marqeta
Platform.sh,Platform.sh Customer Success Engineer customer success git php python magento linux customer support engineer php,https://remoteok.io//remote-jobs/71013-remote-customer-success-engineer-platform-sh
Marqeta,Marqeta Sr. Application Security Engineer - Oakland or Remote python go javascript ruby java infosec engineer ruby,https://remoteok.io//remote-jobs/70995-remote-sr-application-security-engineer-oakland-or-remote-marqeta
MADE.com,MADE.com Python Developer python oop sql dns cookies api kanban dev digital nomad,https://remoteok.io//remote-jobs/70764-remote-python-developer-made-com
Divio,Divio Django Python Developer python dev digital nomad,https://remoteok.io//remote-jobs/70700-remote-django-python-developer-divio
perengo inc.,perengo inc. Senior Postgres/rds and Redshift Engineer postgres amazon rds sql python redshift engineer amazon engineer senior,https://remoteok.io//remote-jobs/70688-remote-senior-postgres-rds-and-redshift-engineer-perengo-inc-
Tao Leadership,Tao Leadership Web Developer angular django redux python typescript aws react javascript angularjs dev web dev digital nomad angularjs,https://remoteok.io//remote-jobs/70590-remote-web-developer-tao-leadership
Contrast Security,Contrast Security Python Instrumentation Engineer python engineer infosec,https://remoteok.io//remote-jobs/70481-remote-python-instrumentation-engineer-contrast-security
eMoney Advisor,eMoney Advisor Python Developer python dev digital nomad,https://remoteok.io//remote-jobs/70262-remote-python-developer-emoney-advisor
Self Decode,Self Decode Backend Python Django Developer python dev backend digital nomad,https://remoteok.io//remote-jobs/70053-remote-backend-python-django-developer-self-decode
Circuit Stream,Circuit Stream Backend Web Developer ruby rails python django node.js javascript aws node js dev backend digital nomad web dev node js ruby,https://remoteok.io//remote-jobs/70003-remote-backend-web-developer-circuit-stream
CircleCI,CircleCI Staff Site Reliability Engineer (sre) devops sre c c++ java python go microservices infrastructure-as-code agile ci/cd operating systems c plus plus dev sys admin engineer digital nomad admin devops c c plus plus,https://remoteok.io//remote-jobs/69933-remote-staff-site-reliability-engineer-sre-circleci
Codelitt,Codelitt Full Stack Developer with React Experience react ruby go python c# vue nodejs javascript c c plus plus node js full stack dev digital nomad c c plus plus node js ruby,https://remoteok.io//remote-jobs/69888-remote-full-stack-developer-with-react-experience-codelitt
MarketMuse,MarketMuse Senior Python Engineer With A Knack For NLP python senior engineer,https://remoteok.io//remote-jobs/69739-remote-senior-python-engineer-with-a-knack-for-nlp-marketmuse
REPAY Realtime Electronic Payments,REPAY Realtime Electronic Payments Full Stack Developer Python python full stack dev digital nomad,https://remoteok.io//remote-jobs/69529-remote-full-stack-developer-python-repay-realtime-electronic-payments
Customer.io,Customer.io Data Analyst sql python data analyst numbers push notifications data science analyst,https://remoteok.io//remote-jobs/69369-remote-data-analyst-customer-io
Doximity,"Doximity Senior Software Engineer, Python engineer python tech stack dev senior digital nomad",https://remoteok.io//remote-jobs/69245-remote-senior-software-engineer-python-doximity
MightySignal,MightySignal Full-stack Engineer redshift ruby on rails aws angular react sql python javascript angularjs ruby full stack mobile engineer angularjs ruby,https://remoteok.io//remote-jobs/69184-remote-full-stack-engineer-for-1m-arr-mobile-sdk-analysis-company-mightysignal
X-Team,X-Team Python Developer python dev digital nomad,https://remoteok.io//remote-jobs/69088-remote-python-developer-x-team
SmileDirectClub,SmileDirectClub Senior Python Developer python dev senior digital nomad,https://remoteok.io//remote-jobs/69047-remote-senior-python-developer-smiledirectclub
Upstack Technologies Inc.,Upstack Technologies Inc. Full Stack Developer node.js javascript web developer angular.js react.js ruby on rails golang python react node js angularjs ruby dev web dev full stack digital nomad node js angularjs ruby,https://remoteok.io//remote-jobs/69034-remote-full-stack-developer-upstack-technologies-inc-
OpenCraft,OpenCraft Open Source Developer & Devops python django aws openstack react open-source javascript dev devops digital nomad devops,https://remoteok.io//remote-jobs/69030-remote-open-source-developer-devops-opencraft
Divio,Divio Django Python Devops python devops devops,https://remoteok.io//remote-jobs/69014-remote-django-python-devops-divio
Teramind,Teramind Technical Product Marketer c++ windows linux python perl java javascript saas aws marketing marcom c# c c plus plus product manager exec c c plus plus,https://remoteok.io//remote-jobs/68996-remote-technical-product-marketer-teramind
GeoComm,GeoComm Senior Software Engineer - Security Video Integration esri gis azure agile sql python c# video streaming video c c plus plus infosec dev senior engineer digital nomad c c plus plus,https://remoteok.io//remote-jobs/68982-remote-senior-software-engineer-security-video-integration-geocomm
Code Careers,Code Careers C Python Developer python dev c c plus plus digital nomad c c plus plus,https://remoteok.io//remote-jobs/68976-remote-c-python-developer-code-careers
Doximity,"Doximity Senior Engineer, Python python engineer senior",https://remoteok.io//remote-jobs/68942-remote-senior-engineer-python-doximity
Screenly,Screenly Frontend and Python Developer python javascript django html5 css docker kubernetes front end dev digital nomad css,https://remoteok.io//remote-jobs/68892-remote-frontend-and-python-developer-screenly
Platform.sh,Platform.sh Devops / SRE docker aws python magento cloud devops devops,https://remoteok.io//remote-jobs/68819-remote-devops-sre-platform-sh
VersaFeed,VersaFeed Senior Python Developer python dev senior digital nomad,https://remoteok.io//remote-jobs/68797-remote-senior-python-developer-versafeed
Canonical,Canonical Cloud Operations Engineer - Americas openstack python kubernetes cloud ops engineer,https://remoteok.io//remote-jobs/68789-remote-cloud-operations-engineer-americas-canonical
Property Meld,Property Meld Senior Software Engineer dev python engineer senior digital nomad,https://remoteok.io//remote-jobs/68749-remote-senior-software-engineer-property-meld
Host Compliance,Host Compliance Python Engineer with a Data Focus python postgres ubuntu aws amzo web services. web dev engineer,https://remoteok.io//remote-jobs/68739-remote-python-engineer-with-a-data-focus-host-compliance
CoGrammar,CoGrammar Python Developer edtech python dev digital nomad,https://remoteok.io//remote-jobs/68679-remote-python-developer-cogrammar
Load Impact,Load Impact Django Python Senior Software Engineer python dev senior engineer digital nomad,https://remoteok.io//remote-jobs/68530-remote-django-python-senior-software-engineer-load-impact
Analytics Fire,Analytics Fire Senior Embedded Linux Developer with C Python 100% Flexible Hours embedded python dev c c plus plus senior linux digital nomad c c plus plus,https://remoteok.io//remote-jobs/68488-remote-senior-embedded-linux-developer-with-c-python-100-flexible-hours-analytics-fire
ShipHero,ShipHero Python Mysql Senior Engineer python sql senior engineer sql,https://remoteok.io//remote-jobs/68446-remote-python-mysql-senior-engineer-shiphero
ShipHero,ShipHero Senior Python Engineer python senior engineer,https://remoteok.io//remote-jobs/68311-remote-senior-python-engineer-shiphero
Merchbar,Merchbar Full Stack Software Engineer fullstack python javascript dev full stack engineer digital nomad,https://remoteok.io//remote-jobs/68296-remote-full-stack-software-engineer-merchbar
Arm,Arm Python Developer python dev digital nomad,https://remoteok.io//remote-jobs/68291-remote-python-developer-arm
JBS Custom Software Solutions,JBS Custom Software Solutions Senior Python Developer python dev senior digital nomad,https://remoteok.io//remote-jobs/68243-remote-senior-python-developer-jbs-custom-software-solutions
trivago N.V,trivago N.V Python Backend Developer python dev backend digital nomad,https://remoteok.io//remote-jobs/68232-remote-python-backend-developer-trivago-n-v
Crossover,Crossover Python Software Engineering Manager python dev exec engineer digital nomad,https://remoteok.io//remote-jobs/68220-remote-python-software-engineering-manager-crossover
Clevertech,Clevertech Senior Python Developer python dev senior digital nomad,https://remoteok.io//remote-jobs/68204-remote-senior-python-developer-clevertech
Comparamais,Comparamais Full-stack Developer/tech Lead php javascript python vue.js full-stack full stack dev exec digital nomad php,https://remoteok.io//remote-jobs/68196-remote-full-stack-developer-tech-lead-comparamais
YMN GROUP,YMN GROUP Python Senior Developer- Remote dev python senior scrapy remote digital nomad,https://remoteok.io//remote-jobs/68169-remote-python-senior-developer-remote-ymn-group
Doximity,"Doximity Python Software Engineer, Data Integration python sql etl spark unix git aws dev engineer digital nomad",https://remoteok.io//remote-jobs/67967-remote-python-software-engineer-data-integration-doximity
4D Pipeline,"4D Pipeline Experienced 3D Software Engineers for Awesome Cutting Edge Projects (augmented Reality, Virtual Reality, Raytracing, Webgl, UE4, and More) 3d augmented reality virtual reality opengl graphics unrealengine webgl c++ python software development c c plus plus vfx dev digital nomad c c plus plus",https://remoteok.io//remote-jobs/67948-remote-experienced-3d-software-engineers-for-awesome-cutting-edge-projects-augmented-reality-virtual-reality-raytracing-webgl-ue4-and-more-4d-pipeline
trivago N.V,trivago N.V Software Engineer Python python dev engineer digital nomad,https://remoteok.io//remote-jobs/68073-remote-software-engineer-python-trivago-n-v
Kangaroo,"Kangaroo Python Backend Developer in Wrocław, PL python java dev backend digital nomad",https://remoteok.io//remote-jobs/67857-remote-python-backend-developer-in-wroclaw-pl-kangaroo
Seez,Seez Kickass Python Machine Learning Engineer python machine learning engineer,https://remoteok.io//remote-jobs/67764-remote-kickass-python-machine-learning-engineer-seez
Property Meld,Property Meld Backend Developer python sql engineer elasticsearch dev backend digital nomad,https://remoteok.io//remote-jobs/67736-remote-backend-developer-property-meld
Niteo,Niteo Devops with a Love for Python Go golang python devops devops,https://remoteok.io//remote-jobs/67696-remote-devops-with-a-love-for-python-go-niteo
