compny,title,link
FineTune Learning,"Remote DevOps Engineer (Docker, AWS, Terraform)",https://stackoverflow.com/jobs/389541/remote-devops-engineer-docker-aws-terraform-finetune-learning
Apacio Ltd,Back-End Developer (Python/Django),https://stackoverflow.com/jobs/397855/back-end-developer-python-django-apacio-ltd
Finsera,Backend Software Engineer (Python),https://stackoverflow.com/jobs/359294/backend-software-engineer-python-finsera
Gorgias,Full-Stack Python Engineer,https://stackoverflow.com/jobs/374584/full-stack-python-engineer-gorgias
Conducto,Strong Generalist Who is Very Good at Python,https://stackoverflow.com/jobs/299847/strong-generalist-who-is-very-good-at-python-conducto
REPAY,Python Full Stack Developer,https://stackoverflow.com/jobs/386498/python-full-stack-developer-repay
Conducto,Site Reliability Engineer Who is Good at Python,https://stackoverflow.com/jobs/388639/site-reliability-engineer-who-is-good-at-python-conducto
YouGov,Python Developer,https://stackoverflow.com/jobs/330681/python-developer-yougov
X-Team,Senior Python Developer (Remote),https://stackoverflow.com/jobs/203899/senior-python-developer-remote-x-team
PeopleDoc,"Python Developer (Onsite in Paris, or Remote in France, UK, Germany)",https://stackoverflow.com/jobs/393644/python-developer-onsite-in-paris-or-remote-in-peopledoc
Sherpany AG,Senior Python / Django Engineer,https://stackoverflow.com/jobs/360695/senior-python-django-engineer-sherpany-ag
"Climate Central, Inc.",Senior Python Engineer for Climate,https://stackoverflow.com/jobs/392616/senior-python-engineer-for-climate-climate-central-inc
FineTune Learning,Senior Full Stack Software Engineer (React Python Flask),https://stackoverflow.com/jobs/270372/senior-full-stack-software-engineer-react-python-finetune-learning
Flashpoint,Senior Python Developer,https://stackoverflow.com/jobs/291957/senior-python-developer-flashpoint
EverQuote Inc.,"Senior software engineer (python, typescript, reactjs, nextjs, kafka, docker)",https://stackoverflow.com/jobs/385234/senior-software-engineer-python-typescript-everquote-inc
Backtracks,Senior Python Developer,https://stackoverflow.com/jobs/393980/senior-python-developer-backtracks
Clevertech,Sr. ETL Database Engineer -  Python [100% REMOTE],https://stackoverflow.com/jobs/397598/sr-etl-database-engineer-python-100-remote-clevertech
Bistrohub Technologies SL,Full-stack product engineer @ Bistrohub,https://stackoverflow.com/jobs/397031/full-stack-product-engineer-bistrohub-bistrohub-technologies-sl
Keelvar,Senior Software Engineer,https://stackoverflow.com/jobs/398164/senior-software-engineer-keelvar
Noom,Senior Backend Engineer (Remote or NYC),https://stackoverflow.com/jobs/283527/senior-backend-engineer-remote-or-nyc-noom
Turnout2020,Senior Software Engineer (Temporary),https://stackoverflow.com/jobs/398975/senior-software-engineer-temporary-turnout2020
"Art & Logic, Inc.",Full Stack Web Developer,https://stackoverflow.com/jobs/370918/full-stack-web-developer-art-logic-inc
Hypothesis.is,Senior Backend Developer (Remote),https://stackoverflow.com/jobs/375432/senior-backend-developer-remote-hypothesisis
Web Summit,Senior Software Engineer (Remote),https://stackoverflow.com/jobs/162807/senior-software-engineer-remote-web-summit
DjangoForce,Expert Django Developer,https://stackoverflow.com/jobs/243958/expert-django-developer-djangoforce
jobandtalent,Backend Engineer (Ruby on Rails),https://weworkremotely.com/company/jobandtalent
OpenCraft,"Open Source Developer & DevOps (Python, Django, AWS, OpenStack)",https://weworkremotely.com/company/opencraft
RebelMouse,Senior Fullstack Engineer (ﾉ◕ヮ◕)ﾉ*:・ﾟ✧,https://weworkremotely.com/company/rebelmouse
Good Eggs,Senior Software Engineer - Mobile,https://weworkremotely.com/company/good-eggs
Lumilinks,Software Engineer: Data / Data Engineer ,https://weworkremotely.com/company/lumilinks
Postscript,Fullstack Engineer,https://weworkremotely.com/company/postscript
FYI,Senior Integrations Engineer,https://weworkremotely.com/company/fyi
Qualio,Senior Software Developer,https://weworkremotely.com/company/qualio
Loss Control Plus,Full Stack Web Developer (Typescript/Node/Angular),https://weworkremotely.com/company/loss-control-plus
Mokriya Inc,Senior Scala Engineer,https://weworkremotely.com/company/mokriya-inc
OpenCraft,"Open Source Developer & DevOps (Python, Django, AWS, OpenStack)",https://weworkremotely.com/company/opencraft
Podsights,Software Engineer,https://weworkremotely.com/company/podsights
Primer,Backend / API Engineer,https://weworkremotely.com/company/primer
Power Home Remodeling,Ruby on Rails Developer,https://weworkremotely.com/remote-jobs/power-home-remodeling-ruby-on-rails-developer
Springboard,Software Engineering Mentor,https://weworkremotely.com/company/springboard
Doximity,"Mobile Software Engineer, iOS (Swift)",https://weworkremotely.com/company/doximity
Power Home Remodeling,Ruby on Rails Developer (5+ years),https://weworkremotely.com/remote-jobs/power-home-remodeling-ruby-on-rails-developer-5-years
Doximity,QA Analyst,https://weworkremotely.com/company/doximity
Bevy,QA Software Engineer,https://weworkremotely.com/remote-jobs/bevy-qa-software-engineer
Clarity Movement Co.,SENIOR FULL STACK DEVELOPER @ CLARITY.IO,https://weworkremotely.com/remote-jobs/clarity-movement-co-senior-full-stack-developer-clarity-io-1
Clevertech,Tech Lead,https://weworkremotely.com/company/clevertech
Unhaggle Inc.,Full Stack Developer (Python & Vue.js),https://weworkremotely.com/remote-jobs/unhaggle-inc-full-stack-developer-python-vue-js-2
WP Media,DevOps Python Django SaaS Developer,https://weworkremotely.com/company/wp-media
Badass Software Agency,Badass Software Agency Seeks Awesome .NET/C# Engineer,https://weworkremotely.com/remote-jobs/badass-software-agency-badass-software-agency-seeks-awesome-net-c-engineer
ReCharge Payments,DevOps Engineer,https://weworkremotely.com/company/recharge-payments
Doximity,"Software Engineer, Full Stack ",https://weworkremotely.com/remote-jobs/doximity-software-engineer-full-stack
X-Team,Senior React Developer ,https://weworkremotely.com/company/x-team
Dataquest ,Senior Product Engineer (Remote - Anywhere),https://weworkremotely.com/company/dataquest
Seez,Seez Independent Self Motivated Python Backend Developer python dev backend digital nomad,https://remoteok.io//remote-jobs/85325-remote-independent-self-motivated-python-backend-developer-seez
Surge,Surge Senior Python Developer python dev senior digital nomad,https://remoteok.io//remote-jobs/85309-remote-senior-python-developer-surge
Backtracks,Backtracks Senior Python Developer python dev senior digital nomad,https://remoteok.io//remote-jobs/85273-remote-senior-python-developer-backtracks
Simple Poll,Simple Poll Software Engineer (full Stack) full stack python javascript dev engineer digital nomad,https://remoteok.io//remote-jobs/85261-remote-software-engineer-full-stack-simple-poll
PeopleDoc,PeopleDoc Python Developer python dev digital nomad,https://remoteok.io//remote-jobs/85253-remote-python-developer-peopledoc
Ascent Software,Ascent Software UK Based Senior Python Engineer Solve Amazing Problems From Home python senior engineer,https://remoteok.io//remote-jobs/85243-remote-uk-based-senior-python-engineer-solve-amazing-problems-from-home-ascent-software
Ascent Software,Ascent Software UK Based Python Engineer python engineer,https://remoteok.io//remote-jobs/85244-remote-uk-based-python-engineer-ascent-software
Skalar Systems,Skalar Systems Python Developer M W X python dev digital nomad,https://remoteok.io//remote-jobs/85239-remote-python-developer-m-w-x-skalar-systems
Labellevie by Deleev,Labellevie by Deleev Devops Avec Des Base En Python python devops devops,https://remoteok.io//remote-jobs/85166-remote-devops-avec-des-base-en-python-labellevie-by-deleev
Toptal,Toptal Freelance Python Developer – Remote python python 3 dev digital nomad,https://remoteok.io//remote-jobs/85053-remote-freelance-python-developer-remote-toptal
Level Agency,Level Agency Senior Python Developer python dev senior digital nomad,https://remoteok.io//remote-jobs/84956-remote-senior-python-developer-level-agency
Scalable Path,Scalable Path FULL Stack Django Developer Project Leader python full stack dev exec digital nomad,https://remoteok.io//remote-jobs/84941-remote-full-stack-django-developer-project-leader-scalable-path
Conducto,Conducto Strong Generalist Who Is Very Good Python python,https://remoteok.io//remote-jobs/84891-remote-strong-generalist-who-is-very-good-python-conducto
Sherpany AG,Sherpany AG Senior Python Django Engineer python senior engineer,https://remoteok.io//remote-jobs/84868-remote-senior-python-django-engineer-sherpany-ag
WP Media,WP Media Devops Python Django Saas Developer saas devops django python dev digital nomad devops,https://remoteok.io//remote-jobs/84795-remote-devops-python-django-saas-developer-wp-media
Gorgias,Gorgias Full Stack Python Engineer python full stack engineer,https://remoteok.io//remote-jobs/85233-remote-full-stack-python-engineer-gorgias
Remotesome,Remotesome Senior Python Developer python senior backend dev digital nomad,https://remoteok.io//remote-jobs/84524-remote-senior-python-developer-remotesome
Scalable Path,Scalable Path FULL Stack Python python full stack,https://remoteok.io//remote-jobs/84400-remote-full-stack-python-scalable-path
Kokoon Technology Ltd,Kokoon Technology Ltd Lead Backend Developer (remote) ruby on rails postgresql python data science postgres ruby dev exec backend digital nomad ruby,https://remoteok.io//remote-jobs/84313-remote-lead-backend-developer-remote-kokoon-technology-ltd
SkillValue,SkillValue Développeur Python C C Mission python c c plus plus c c plus plus,https://remoteok.io//remote-jobs/84275-remote-developpeur-python-c-c-mission-skillvalue
PostHog,PostHog First Engineer - Full Stack full-stack django react javascript full stack python engineer,https://remoteok.io//remote-jobs/84205-remote-first-engineer-full-stack-posthog
Drops,Drops QA Automation Engineer qa quality assurance automation cypress javascript python ci engineer,https://remoteok.io//remote-jobs/84080-remote-qa-automation-engineer-drops
PeopleDoc,PeopleDoc Python Developer python dev digital nomad,https://remoteok.io//remote-jobs/84032-remote-python-developer-peopledoc
User Research International,User Research International Paid Research Study For Students Instructors Using Python python teaching,https://remoteok.io//remote-jobs/83913-remote-paid-research-study-for-students-instructors-using-python-user-research-international
Loadsmart,Loadsmart Senior Python Back End Engineer backend python senior engineer,https://remoteok.io//remote-jobs/83874-remote-senior-python-back-end-engineer-loadsmart
ShipHero,ShipHero Senior Python Developer python dev senior digital nomad,https://remoteok.io//remote-jobs/83869-remote-senior-python-developer-shiphero
Exputec,Exputec Python Backend Developer python dev backend digital nomad,https://remoteok.io//remote-jobs/83854-remote-python-backend-developer-exputec
Overloop,Overloop Python Data Engineer python engineer,https://remoteok.io//remote-jobs/83826-remote-python-data-engineer-overloop
Flowcast,Flowcast Senior Python Engineer Fintech python finance senior engineer,https://remoteok.io//remote-jobs/83608-remote-senior-python-engineer-fintech-flowcast
Modus Create,Modus Create Back End Engineer Python backend python engineer,https://remoteok.io//remote-jobs/83815-remote-back-end-engineer-python-modus-create
Jetcake,Jetcake Backend Developer python django flask dev digital nomad backend,https://remoteok.io//remote-jobs/83559-remote-backend-developer-jetcake
Vizibl,Vizibl Backend Engineer python kubernettes docker gcp postgresql redis rest postgres engineer backend,https://remoteok.io//remote-jobs/83539-remote-backend-engineer-vizibl
Clevertech,Clevertech Python Data Engineer 100 python engineer,https://remoteok.io//remote-jobs/83496-remote-python-data-engineer-100-clevertech
vidIQ,vidIQ Senior Data Engineer python scala etl aws data pipeline senior engineer,https://remoteok.io//remote-jobs/83438-remote-senior-data-engineer-vidiq
TileDB,TileDB Python Engineer python engineer,https://remoteok.io//remote-jobs/83381-remote-python-engineer-tiledb
Soshace,Soshace Python python,https://remoteok.io//remote-jobs/83309-remote-python-soshace
Omstars,Omstars Tech Lead - NO Longer Available javascript react python django project management exec,https://remoteok.io//remote-jobs/83287-remote-tech-lead-no-longer-available-omstars
Doximity,Doximity Python Automation Engineer python data engineering ci pipeline aws circleci pytest shell sql engineer,https://remoteok.io//remote-jobs/83247-remote-python-automation-engineer-doximity
Clevertech,Clevertech Python Backend Developer 100 python dev backend digital nomad,https://remoteok.io//remote-jobs/83231-remote-python-backend-developer-100-clevertech
Clevertech,Clevertech React Python Developer 100 react python dev javascript digital nomad,https://remoteok.io//remote-jobs/83127-remote-react-python-developer-100-clevertech
Numbrs Personal Finance AG,Numbrs Personal Finance AG Security Engineer - Remote security aws python infosec engineer,https://remoteok.io//remote-jobs/83106-remote-security-engineer-remote-numbrs-personal-finance-ag
Soshace,Soshace Python Back End Developer backend python dev digital nomad,https://remoteok.io//remote-jobs/83097-remote-python-back-end-developer-soshace
Clevertech,Clevertech 100% Python React Developer react python dev javascript digital nomad,https://remoteok.io//remote-jobs/82984-remote-100-python-react-developer-clevertech
Platform.sh,Platform.sh Python Go Cloud Engineer python cloud engineer,https://remoteok.io//remote-jobs/77340-remote-python-go-cloud-engineer-platform-sh
Scanslated,Scanslated Python Django Developer python dev digital nomad,https://remoteok.io//remote-jobs/77334-remote-python-django-developer-scanslated
ReCharge Payments,ReCharge Payments API Software Engineer Python python dev api engineer digital nomad,https://remoteok.io//remote-jobs/77226-remote-api-software-engineer-python-recharge-payments
Atlastix,Atlastix ELK Stack Developer elasticsearch elk ruby python dev digital nomad ruby,https://remoteok.io//remote-jobs/77164-remote-elk-stack-developer-atlastix
Backblaze,Backblaze Senior Python Engineer python senior engineer,https://remoteok.io//remote-jobs/77089-remote-senior-python-engineer-backblaze
Wildfish,Wildfish Full Stack Django Developer django python full stack dev digital nomad,https://remoteok.io//remote-jobs/77074-remote-full-stack-django-developer-wildfish
REPAY,REPAY Full Stack Developer (python) python aws javascript pyramid django full stack dev digital nomad,https://remoteok.io//remote-jobs/77035-remote-full-stack-developer-python-repay
Soshace,Soshace Full Stack React Django Developer react python full stack dev javascript digital nomad,https://remoteok.io//remote-jobs/76912-remote-full-stack-react-django-developer-soshace
Platform.sh,Platform.sh Python Cloud Engineer python cloud engineer,https://remoteok.io//remote-jobs/76837-remote-python-cloud-engineer-platform-sh
ReCharge Payments,ReCharge Payments Senior Python Engineer python senior engineer,https://remoteok.io//remote-jobs/76813-remote-senior-python-engineer-recharge-payments
ReCharge Payments,ReCharge Payments Senior Python Engineer Platform python senior engineer,https://remoteok.io//remote-jobs/76757-remote-senior-python-engineer-platform-recharge-payments
XOi Technologies,XOi Technologies Senior Python Engineer python senior engineer,https://remoteok.io//remote-jobs/76692-remote-senior-python-engineer-xoi-technologies
Clevertech,Clevertech Python Data Science python data science,https://remoteok.io//remote-jobs/76570-remote-python-data-science-clevertech
Doximity,"Doximity Software Engineer, Full Stack ruby rails javascript python spark airflow mysql vue healthcare tech startup sql full stack dev engineer digital nomad sql ruby",https://remoteok.io//remote-jobs/76493-remote-software-engineer-full-stack-doximity
YouGov,YouGov Python Developer python dev digital nomad,https://remoteok.io//remote-jobs/76481-remote-python-developer-yougov
Astra,Astra Backend Engineer python google cloud api app engine datastore nosql cloud engineer backend,https://remoteok.io//remote-jobs/76361-remote-backend-engineer-astra
Scrapinghub,Scrapinghub Python Developer python dev digital nomad,https://remoteok.io//remote-jobs/76269-remote-python-developer-scrapinghub
Geektastic,Geektastic Code Challenge Reviewer 100% £50 Per Hour Java Javascript PHP Python C# Ruby CSS HTML SQL Scala iOS Android ios python dev javascript java c c plus plus css php html scala ruby android digital nomad c c plus plus css php html ruby ios,https://remoteok.io//remote-jobs/76263-remote-code-challenge-reviewer-100-50-per-hour-java-javascript-php-python-c-ruby-css-html-sql-scala-ios-android-geektastic
Soshace,Soshace Back End Django Developer backend python dev digital nomad,https://remoteok.io//remote-jobs/76164-remote-back-end-django-developer-soshace
Iterative,Iterative Senior Software Engineer open source python dev tools dvc machine learning ml data science dev engineer digital nomad senior,https://remoteok.io//remote-jobs/76126-remote-senior-software-engineer-iterative
Pivotal Energy Solutions,Pivotal Energy Solutions Permanent Django Developer python dev digital nomad,https://remoteok.io//remote-jobs/76108-remote-permanent-django-developer-pivotal-energy-solutions
MVPF,MVPF Developer or Senior Developer javascript react node.js react native angular java python devops node js angularjs dev senior digital nomad devops node js angularjs,https://remoteok.io//remote-jobs/75960-remote-developer-or-senior-developer-mvpf
GooseChase,GooseChase Full Stack Web Developer javascript react python django full stack frontend backend game startup front end game dev dev web dev digital nomad,https://remoteok.io//remote-jobs/75932-remote-full-stack-web-developer-goosechase
Pupil Labs,Pupil Labs Senior Full Stack Developer python devops kubernetes docker full stack dev senior digital nomad devops,https://remoteok.io//remote-jobs/75838-remote-senior-full-stack-developer-pupil-labs
komoot,komoot Senior Data Analyst sql python data_analyst pandas data science analyst senior,https://remoteok.io//remote-jobs/75791-remote-senior-data-analyst-komoot
Pluralsight,Pluralsight Back End Python Developer backend python dev digital nomad,https://remoteok.io//remote-jobs/75766-remote-back-end-python-developer-pluralsight
PolySwarm,PolySwarm Senior Full-stack Developer python docker javascript blockchain react cybersecurity full stack dev senior digital nomad,https://remoteok.io//remote-jobs/75742-remote-senior-full-stack-developer-polyswarm
CB Insights,CB Insights Senior Backend Engineer go python mysql sql senior engineer backend sql,https://remoteok.io//remote-jobs/75696-remote-senior-backend-engineer-cb-insights
Specula.io,"Specula.io Sr. Full-stack Developer (node, Vue, Typescript, Python, SQL, Elastic) - Fully Remote Startup fullstack backend frontend typescript node vue startup remotework javascript node js front end python full stack dev digital nomad node js",https://remoteok.io//remote-jobs/75688-remote-sr-full-stack-developer-node-vue-typescript-python-sql-elastic-fully-remote-startup-specula-io
PolySwarm,PolySwarm Senior Front-end Developer ui/ux blockchain python javascript jekyll design front end dev senior digital nomad,https://remoteok.io//remote-jobs/75673-remote-senior-front-end-developer-polyswarm
Snowdrop,Snowdrop Senior Software Engineer python js docker flask django vue aws postgresql dev senior engineer digital nomad javascript postgres,https://remoteok.io//remote-jobs/75658-remote-senior-software-engineer-snowdrop
Soshace,Soshace Python Back End Web Developer backend python dev web dev digital nomad,https://remoteok.io//remote-jobs/75581-remote-python-back-end-web-developer-soshace
Soshace,Soshace Full Stack Developer With React Django react python full stack dev javascript digital nomad,https://remoteok.io//remote-jobs/75542-remote-full-stack-developer-with-react-django-soshace
SilviaTerra,SilviaTerra Full Stack Developer python forestry html/css javascript ai for good css html full stack dev digital nomad css html,https://remoteok.io//remote-jobs/75473-remote-full-stack-developer-silviaterra
MageMojo,MageMojo Senior SRE Kubernetes saltstack docker kubernetes jenkins aws python linux devops senior devops,https://remoteok.io//remote-jobs/75202-remote-senior-sre-kubernetes-magemojo
CVEDIA,CVEDIA Senior Python Developer python dev senior digital nomad,https://remoteok.io//remote-jobs/75073-remote-senior-python-developer-cvedia
"ORCID, Inc.","ORCID, Inc. Senior Devops Engineer devops servers server infrastructure engineer software engineer linux jenkins ci/cd python nosql puppet dev senior digital nomad devops",https://remoteok.io//remote-jobs/75009-remote-senior-devops-engineer-orcid-inc-
Labster,Labster Principle Python Software Engineer python dev engineer digital nomad,https://remoteok.io//remote-jobs/74984-remote-principle-python-software-engineer-labster
DomainTools,DomainTools Senior Python Developer python dev senior digital nomad,https://remoteok.io//remote-jobs/74941-remote-senior-python-developer-domaintools
Doximity,"Doximity Software Engineer, Data (product Integration) data healthcare python airflow spark snowflake mysql unix git aws sql product manager dev engineer digital nomad exec sql",https://remoteok.io//remote-jobs/74936-remote-software-engineer-data-product-integration-doximity
Clevertech,Clevertech Senior Python Developer Django Flask python dev senior digital nomad,https://remoteok.io//remote-jobs/74857-remote-senior-python-developer-django-flask-clevertech
CleanCapital,CleanCapital Senior Python Engineer python senior engineer,https://remoteok.io//remote-jobs/74849-remote-senior-python-engineer-cleancapital
Flashpoint,Flashpoint Senior Python Developer python dev senior digital nomad,https://remoteok.io//remote-jobs/74829-remote-senior-python-developer-flashpoint
Draftable,"Draftable Senior Full-stack Engineer (python, JS) python django javascript react rest api html css api full stack senior engineer css html",https://remoteok.io//remote-jobs/74601-remote-senior-full-stack-engineer-python-js-draftable
Fraym,Fraym Full-stack Software Engineer software engineer django gis angularjs angular javascript full stack python engineer dev digital nomad angularjs,https://remoteok.io//remote-jobs/74444-remote-full-stack-software-engineer-fraym
Clevertech,Clevertech Quantitative Developer Python python dev digital nomad,https://remoteok.io//remote-jobs/74388-remote-quantitative-developer-python-clevertech
Elastic,Elastic Cloud Lead Python Engineer python cloud exec engineer,https://remoteok.io//remote-jobs/74371-remote-cloud-lead-python-engineer-elastic
Clevertech,Clevertech Senior Python Developer Quantitative Modeling python dev senior digital nomad,https://remoteok.io//remote-jobs/74363-remote-senior-python-developer-quantitative-modeling-clevertech
DL Remote,DL Remote Senior Backend Engineer - Golang Focus (remote) software engineer software developer python go golang java javascript ruby backend engineer dev senior digital nomad ruby,https://remoteok.io//remote-jobs/74351-remote-senior-backend-engineer-golang-focus-remote-dl-remote
User Research International,User Research International Paid Research Study For Developers With Machine Learning Python Experience python machine learning,https://remoteok.io//remote-jobs/74209-remote-paid-research-study-for-developers-with-machine-learning-python-experience-user-research-international
Clevertech,Clevertech Python C Developer python dev c c plus plus digital nomad c c plus plus,https://remoteok.io//remote-jobs/74190-remote-python-c-developer-clevertech
Labster,Labster Senior Python Software Engineer python dev senior engineer digital nomad,https://remoteok.io//remote-jobs/74183-remote-senior-python-software-engineer-labster
WeTravel,WeTravel Senior Backend Developer ruby python java c++ c c plus plus dev senior backend digital nomad c c plus plus ruby,https://remoteok.io//remote-jobs/74163-remote-senior-backend-developer-wetravel
Backtracks,Backtracks Senior Python Developer python dev senior digital nomad,https://remoteok.io//remote-jobs/74106-remote-senior-python-developer-backtracks
3 other jobs Analytics Fire,3 other jobs Analytics Fire Senior Embedded Linux Developer with Python 100% Flexible Hours embedded python dev senior linux digital nomad,https://remoteok.io//remote-jobs/74065-remote-senior-embedded-linux-developer-with-python-100-flexible-hours-3-other-jobs-analytics-fire
Doximity,"Doximity Engineering Manager, Mobile manager mentor mobile ios android swift kotlin python ruby rails spark airflow javascript healthcare exec engineer ruby ios",https://remoteok.io//remote-jobs/74016-remote-engineering-manager-mobile-doximity
Doximity,"Doximity Engineering Manager, Infrastructure manager mentor infrastructure engineering swift kotlin ruby rails python chef terraform jenkins engineer exec ruby",https://remoteok.io//remote-jobs/74014-remote-engineering-manager-infrastructure-doximity
ActiveState Software,ActiveState Software Python 2 Language Specialist python,https://remoteok.io//remote-jobs/74009-remote-python-2-language-specialist-activestate-software
Capital,Capital Senior Python Developer Interested Finance python dev finance senior digital nomad,https://remoteok.io//remote-jobs/74264-remote-senior-python-developer-interested-finance-capital
AlphaSights,AlphaSights Software Engineer fullstack java python ruby dev engineer digital nomad ruby,https://remoteok.io//remote-jobs/73979-remote-software-engineer-alphasights
